Time,First Name,Last Name,Headline,Country/Region,Ticket Type,Level,Text,Reaction Count,Bio,Website,Linkedin,X,Company/Organization
2025-10-17T15:50:38-04:00,Shahan,StFleur,Certified ServiceNow System Administrator,United States,Free,top,What time is this session going to begin?,0,"With a robust background in customer service, I have honed my skills through a variety of roles, where I’ve consistently demonstrated a commitment to delivering exceptional support and fostering positive client relationships. Now, I am excited to pivot my career towards technology, with a specific focus on becoming an expert in the ServiceNow environment.",,https://www.linkedin.com/in/shahan-s/,,ServiceNow
2025-10-17T15:51:47-04:00,Jay,Betancourt,IT Service Desk Manager,United States,Free,top,Not sure,0,,https://jbpoindexter.com/,https://www.linkedin.com/in/jaybetancourt/,,JB Poindexter & Co
2025-10-17T15:52:11-04:00,Mike,Roberts,Hiring Apprentices,United States,Free,top,Soon.,1,,https://cccareers.org,https://www.linkedin.com/in/merobertsjr/,https://twitter.com/sr_software_dev,
2025-10-17T15:52:11-04:00,Chris,Schuh,The ServiceNow Magician,,Free,top,"I'm a freelancer as well, so curious what others are doing in the ecosystem.",0,Connect with me on LinkedIn: https://www.linkedin.com/in/chris-schuh-servicenow-magician/,https://snowproconsultants.com/,https://www.linkedin.com/in/chris-schuh-servicenow-magician/,,"SNow Pro Consultants, Inc."
2025-10-17T15:52:17-04:00,Ahmad,Ibitoye,,Nigeria,Free,top,just waiting for it to begin,0,,,https://www.linkedin.com/in/ahmad-ibitoye,,Customizo
2025-10-17T15:52:18-04:00,Trey,Carroll,ServiceNow Dev and Entrepreneur,United States,Free,top,Scheduled for 14:45.   Must be some issue.,0,"I love ServiceNow and the ServiceNow community.  I'm always looking for interesting things to learn, looking for ways to make the platform do cool new things, looking for ways to learn how to hone the craft.",,https://www.linkedin.com/in/trey-carroll-666aa572/,,Lumen
2025-10-17T15:52:43-04:00,Jace,Organizer,,United Kingdom,Organiser pass,top,Sorry,0,,,,,
2025-10-17T15:53:01-04:00,Tommy,Sønderstgaard Vølcker,SN Architect/SNUG Lead DK,Denmark,Free,top, https://giphy.com/gifs/time-first-sfw-RsWK4iqQOkL3a,0,Sharing is caring,,https://www.linkedin.com/in/2mmy/,,Energinet
2025-10-17T15:53:02-04:00,Chris,Schuh,The ServiceNow Magician,,Free,top,All good Jace - thanks to you and your team for all the hard work so far,4,Connect with me on LinkedIn: https://www.linkedin.com/in/chris-schuh-servicenow-magician/,https://snowproconsultants.com/,https://www.linkedin.com/in/chris-schuh-servicenow-magician/,,"SNow Pro Consultants, Inc."
2025-10-17T15:54:46-04:00,Jace,Benson,It's me,United States,Free,top,All sorted now,4,I started on Servicenow in '07.  I create the things I want to exist.,https://getaiinabox.com,http://linkedin.com/in/jacebenson,,AI In A Box
2025-10-17T15:54:58-04:00,Chris,Schuh,The ServiceNow Magician,,Free,top,We are good. I can see and hear you.,0,Connect with me on LinkedIn: https://www.linkedin.com/in/chris-schuh-servicenow-magician/,https://snowproconsultants.com/,https://www.linkedin.com/in/chris-schuh-servicenow-magician/,,"SNow Pro Consultants, Inc."
2025-10-17T15:55:20-04:00,Shahan,StFleur,Certified ServiceNow System Administrator,United States,Free,top,Good afternoon!,0,"With a robust background in customer service, I have honed my skills through a variety of roles, where I’ve consistently demonstrated a commitment to delivering exceptional support and fostering positive client relationships. Now, I am excited to pivot my career towards technology, with a specific focus on becoming an expert in the ServiceNow environment.",,https://www.linkedin.com/in/shahan-s/,,ServiceNow
2025-10-17T15:55:25-04:00,Trey,Carroll,ServiceNow Dev and Entrepreneur,United States,Free,top,No worries.  Thank you guys so much for this.   If technical issues interpose... if we can just get a YT video afterwards well be content.  :),3,"I love ServiceNow and the ServiceNow community.  I'm always looking for interesting things to learn, looking for ways to make the platform do cool new things, looking for ways to learn how to hone the craft.",,https://www.linkedin.com/in/trey-carroll-666aa572/,,Lumen
2025-10-17T15:55:45-04:00,Kalisha,Moore,ServiceNow Developer,United States,Free,top,"Hey Mike, excited for this session!",0,Here to learn and help :),,https://www.linkedin.com/in/kalishamoore/,,Kwaan Bear
2025-10-17T15:57:23-04:00,Cory CJ,Wesley,Problem Solver,United States,Free,top,Use a different door! Love it!,1,Cohost of CJ & The Duke. Chief ServiceNow Evangelist (not a thing - but if it was - that's me)  ,,https://www.linkedin.com/in/cjwesley/,,TekVoyant
2025-10-17T16:00:02-04:00,Chris,Schuh,The ServiceNow Magician,,Free,reply,Right? Love the wording there.,1,Connect with me on LinkedIn: https://www.linkedin.com/in/chris-schuh-servicenow-magician/,https://snowproconsultants.com/,https://www.linkedin.com/in/chris-schuh-servicenow-magician/,,"SNow Pro Consultants, Inc."
2025-10-17T16:04:00-04:00,Cory CJ,Wesley,Problem Solver,United States,Free,reply,Yep! The goal is to get inside. Use the window if you have to - but get in the building!,0,Cohost of CJ & The Duke. Chief ServiceNow Evangelist (not a thing - but if it was - that's me)  ,,https://www.linkedin.com/in/cjwesley/,,TekVoyant
2025-10-17T15:57:25-04:00,Shahan,StFleur,Certified ServiceNow System Administrator,United States,Free,top, https://giphy.com/gifs/abcnetwork-the-good-doctor-abc-doctorabc-YS8c0Z7in21AM4A2AR,0,"With a robust background in customer service, I have honed my skills through a variety of roles, where I’ve consistently demonstrated a commitment to delivering exceptional support and fostering positive client relationships. Now, I am excited to pivot my career towards technology, with a specific focus on becoming an expert in the ServiceNow environment.",,https://www.linkedin.com/in/shahan-s/,,ServiceNow
2025-10-17T16:02:45-04:00,Simone,Williams,,United States,Free,top,Great points!,0,,,,,Jamf
2025-10-17T16:04:45-04:00,Diogo,Ramos,Senior Developer @ Freelance / 2025 Rising Star,Belgium,Free,top,Lots of good info here 👏 ,0,,,https://www.linkedin.com/in/diogoramos1/,,Freelancer
2025-10-17T16:05:43-04:00,Chris,Schuh,The ServiceNow Magician,,Free,top,Great job and thank you for the helpful information!,0,Connect with me on LinkedIn: https://www.linkedin.com/in/chris-schuh-servicenow-magician/,https://snowproconsultants.com/,https://www.linkedin.com/in/chris-schuh-servicenow-magician/,,"SNow Pro Consultants, Inc."
2025-10-17T16:05:47-04:00,Simone,Williams,,United States,Free,top,Thank you!,0,,,,,Jamf
2025-10-17T16:06:22-04:00,Youly,Ly,Cybersecurity student,United States,Free,top,Thank you Mike for your 15 min advice. Lots of great info ,0,Aspiring cybersecurity analyst ,,,,MVC
2025-10-17T16:06:48-04:00,Shahan,StFleur,Certified ServiceNow System Administrator,United States,Free,top,So glad I tuned into this session!,1,"With a robust background in customer service, I have honed my skills through a variety of roles, where I’ve consistently demonstrated a commitment to delivering exceptional support and fostering positive client relationships. Now, I am excited to pivot my career towards technology, with a specific focus on becoming an expert in the ServiceNow environment.",,https://www.linkedin.com/in/shahan-s/,,ServiceNow
2025-10-17T16:06:58-04:00,Cory CJ,Wesley,Problem Solver,United States,Free,top,*The Jace randomly appears and blesses the segment*,0,Cohost of CJ & The Duke. Chief ServiceNow Evangelist (not a thing - but if it was - that's me)  ,,https://www.linkedin.com/in/cjwesley/,,TekVoyant
2025-10-17T16:10:00-04:00,Cory CJ,Wesley,Problem Solver,United States,Free,top,That part!,0,Cohost of CJ & The Duke. Chief ServiceNow Evangelist (not a thing - but if it was - that's me)  ,,https://www.linkedin.com/in/cjwesley/,,TekVoyant
2025-10-17T16:10:24-04:00,Cory CJ,Wesley,Problem Solver,United States,Free,top,Full-time costs extra. Yesterday's price is not today's price!,1,Cohost of CJ & The Duke. Chief ServiceNow Evangelist (not a thing - but if it was - that's me)  ,,https://www.linkedin.com/in/cjwesley/,,TekVoyant
2025-10-17T16:10:42-04:00,Cory CJ,Wesley,Problem Solver,United States,Free,top,Good to see you Mike! Great chat,0,Cohost of CJ & The Duke. Chief ServiceNow Evangelist (not a thing - but if it was - that's me)  ,,https://www.linkedin.com/in/cjwesley/,,TekVoyant
2025-10-17T16:10:46-04:00,David,Willequer,"Developer & System Admin | ServiceNow, Cherwell, Aha!",United States,Free,top,Thanks for the great presentation!,0,"I am a born & raised Alaskan with a passion for the unknown and problem solving. I currently work as a Application Engineer III on GCI’s Technology Applications team where my primary role is to develop and manage the workflow automation tools that empower our employees such as ServiceNow, Cherwell & Aha! Roadmaps & Aha! Ideas. I consider myself a jack-of-all-trades, I know a little about a lot and if I don't know something, I can find an answer. I have a strong passion for learning in general, gaining a deep understanding of the systems I work on and delivering the best user experiences by thoroughly testing my deliverables.",,https://www.linkedin.com/in/david-willequer-56357a139/,,GCI
2025-10-17T16:11:18-04:00,Cory CJ,Wesley,Problem Solver,United States,Free,top,Dropping gems bro!,0,Cohost of CJ & The Duke. Chief ServiceNow Evangelist (not a thing - but if it was - that's me)  ,,https://www.linkedin.com/in/cjwesley/,,TekVoyant
2025-10-17T16:14:42-04:00,Jay,Betancourt,IT Service Desk Manager,United States,Free,top,Great presentation!,0,,https://jbpoindexter.com/,https://www.linkedin.com/in/jaybetancourt/,,JB Poindexter & Co
2025-10-17T16:15:16-04:00,Jace,Benson,It's me,United States,Free,top,Tahnsk @Mike Roberts ,0,I started on Servicenow in '07.  I create the things I want to exist.,https://getaiinabox.com,http://linkedin.com/in/jacebenson,,AI In A Box