Time,First Name,Last Name,Headline,Country/Region,Ticket Type,Level,Text,Reaction Count,Bio,Website,Linkedin,X,Company/Organization
2025-10-17T14:16:55-04:00,Jace,Benson,It's me,United States,Free,top,"Hello, workign on getting the speaker here.",0,I started on Servicenow in '07.  I create the things I want to exist.,https://getaiinabox.com,http://linkedin.com/in/jacebenson,,AI In A Box
2025-10-17T14:17:10-04:00,Chad,Hayes,ServiceNow Platform Engineer,United States,Free,top,FYI this session has a 'Join Stage' button that others haven't had.,1,"Senior ServiceNow Platform Engineer with a background in retail leadership, cybersecurity, and federal IT transformation. I specialize in Virtual Agent design, workflow automation, and platform-native solutions for the world’s second largest ServiceNow instance located in the GCC.",,http://www.linkedin.com/in/chad-hayes-dev,,SAIC
2025-10-17T14:17:22-04:00,Chad,Hayes,ServiceNow Platform Engineer,United States,Free,top,Seems dangerous,0,"Senior ServiceNow Platform Engineer with a background in retail leadership, cybersecurity, and federal IT transformation. I specialize in Virtual Agent design, workflow automation, and platform-native solutions for the world’s second largest ServiceNow instance located in the GCC.",,http://www.linkedin.com/in/chad-hayes-dev,,SAIC
2025-10-17T14:18:19-04:00,Casey,Ferguson,Sr. Director of Solutions,United States,Free,top,"Rob's session got me to fire up SN IDE in a PDI and install the new agent builder to 1-shot-prompt an app idea i had. and it worked! (not 100% related, but reminded me it was available)",2,Enterprise Technology Leader & AI Strategist; professional ServiceNow Kool-Aid distributor.,,http://linkedin.com/in/caseynsb,,HaloKinetic
2025-10-17T14:20:11-04:00,SENDHIL,ELUMALAI,,United States,Free,top,could you maximize your presenter screen,0,,,,,Global Alliant Inc.
2025-10-17T14:21:21-04:00,Carleen,Carter,"Architect & Developer, ServiceNow MVP & CMA",United Kingdom,Free,top,Thanks Chad!,1,,https://smartcarleen.com,https://www.linkedin.com/in/carleencarter/,,Serenity
2025-10-17T14:35:09-04:00,Darren,Lau,,United States,Free,top,👏 ,0,,,,,Lawrence Livermore National Lab
2025-10-17T14:35:10-04:00,Chad,Hayes,ServiceNow Platform Engineer,United States,Free,top,Thank you!,0,"Senior ServiceNow Platform Engineer with a background in retail leadership, cybersecurity, and federal IT transformation. I specialize in Virtual Agent design, workflow automation, and platform-native solutions for the world’s second largest ServiceNow instance located in the GCC.",,http://www.linkedin.com/in/chad-hayes-dev,,SAIC